filename,topic,motivation,contribution,detail_nuance,evidence_contribution_2,weaker_result,narrow_impact,broad_impact
2404.19065v1,The paper addresses the development of a unified embodied agent capable of performing tasks across multiple interactive vision-language domains using memory-augmented language models.,"There is a need for an instructable agent that can generalize across different visual and linguistic environments, addressing the gap in current systems which often require domain-specific training to perform well.","The authors introduce HELPER-X, an extended version of HELPER with enhanced memory capabilities and integrated APIs for question asking, enabling it to operate effectively across four distinct interactive vision-language domains.",HELPER-X uses a wider array of examples and prompts in its memory to improve task planning and incorporates additional APIs to enhance its ability to ask questions and interact more intelligently within the given environments.,"The agent demonstrates few-shot, state-of-the-art performance across four benchmarks (ALFRED, TEACh, DialFRED, and Tidy Task) without in-domain training, showcasing its versatility and adaptability.","While HELPER-X performs well across diverse tasks, the paper does not detail specific scenarios where it underperforms or any limitations related to its memory-augmented approach.",The immediate application of HELPER-X is in research settings for developing more generalized embodied agents that can handle a variety of interactive vision-language tasks without extensive domain-specific training.,"This work could lead to the development of more versatile and adaptable AI systems capable of handling diverse real-world tasks, potentially reducing the need for specialized training across different domains."
2402.04559v4,"The paper investigates whether large language model (LLM) agents can simulate human trust behavior within the context of Trust Games, a framework used in behavioral economics.",Understanding if LLMs can mimic human trust behavior is crucial for their application in social science and role-playing scenarios where realistic human interaction simulation is required.,"The authors demonstrate that LLM agents, particularly GPT-4, exhibit high alignment with human trust behaviors under the Trust Games framework, suggesting they can effectively simulate such behaviors.",The study examines how LLM agents behave in terms of trust and explores biases in their trust behavior as well as differences between trusting other LLMs versus humans.,"Empirical evidence shows that GPT-4 agents align closely with human trust behavior, indicating the feasibility of using LLMs to simulate trust dynamics observed in behavioral economics experiments.","The paper notes limitations and open questions regarding biases in agent trust behaviors and how external manipulations affect these behaviors, suggesting areas for further research.","This work provides insights into the capabilities and limitations of LLM agents in simulating human trust behavior, which can inform the design of more realistic social simulations and role-playing applications.","The findings have broader implications for fields that rely on trust dynamics, such as economics, psychology, and artificial intelligence, potentially leading to advancements in AI-driven social science research."
2404.07677v2,The paper addresses the integration of Large Language Models (LLMs) with knowledge graphs (KGs) to enhance natural language processing tasks.,"Current methods that integrate LLMs and KGs rely heavily on the LLM's analysis, neglecting the rich cognitive potential within KGs. This gap motivates the need for a more balanced approach that leverages both components effectively.","We introduce Observation-Driven Agent (ODA), an AI agent framework designed to enhance task-solving by integrating KG reasoning through observation, action, and reflection cycles.","ODA uses a recursive observation mechanism to manage the exponential growth of knowledge during observation phases, which is then integrated into its action and reflection modules for enhanced reasoning capabilities.",Experiments show that ODA achieves state-of-the-art performance on several datasets with notable accuracy improvements of 12.87% and 8.9%.,"The paper does not explicitly mention limitations, but the recursive observation mechanism may introduce computational overhead or complexity in certain scenarios.","ODA can be applied to specific NLP tasks that require integration of LLMs with KGs, providing immediate improvements in accuracy and reasoning capabilities.","This work could lead to more sophisticated AI systems capable of leveraging both LLMs and KGs effectively, potentially influencing the development of future AI frameworks and applications."
2410.02958v2,The paper addresses the development of an automated machine learning (AutoML) framework that leverages large language models (LLMs) to automate the entire AI pipeline from data retrieval to model deployment.,"Current AutoML systems are complex and require significant technical expertise, limiting their usability for non-experts. This gap necessitates a more accessible and efficient AutoML solution that can handle the full development pipeline without extensive human intervention.","The paper introduces AutoML-Agent, a novel multi-agent framework designed to automate the entire AI development process using specialized LLM agents that collaborate to deliver deployment-ready models based on user task descriptions.","AutoML-Agent employs a retrieval-augmented planning strategy for enhanced exploration and optimal plan search. It decomposes tasks into sub-tasks like data preprocessing and neural network design, each handled by specialized agents operating in parallel.","Experiments across seven downstream tasks using fourteen datasets demonstrate that AutoML-Agent achieves higher success rates in automating the full AutoML process compared to existing methods, with good performance across diverse domains.",The paper does not extensively discuss scenarios where the framework might underperform or specific limitations of its multi-agent approach and retrieval-augmented planning strategy.,"AutoML-Agent can be immediately applied in settings requiring rapid development of data-driven solutions by non-expert users, streamlining the process from data retrieval to model deployment.",The introduction of AutoML-Agent has wider implications for democratizing AI development by making advanced machine learning techniques more accessible and efficient for a broader range of users.
2402.11208v2,"The paper investigates backdoor threats to Large Language Model (LLM)-based agents, focusing on the reliability and security issues in real-world applications.","Ensuring the safety of LLM-based agents is critical as they are increasingly used in sensitive areas like finance and healthcare. However, current research has not adequately addressed these safety concerns.",The authors introduce a general framework for agent backdoor attacks and analyze various forms of such attacks on LLM-based agents.,"Agent backdoor attacks can manipulate either the final output distribution or intermediate reasoning steps without affecting the final output, with triggers hidden in user queries or environmental observations.","Experiments demonstrate that LLM-based agents are highly vulnerable to these backdoor attacks, and existing textual defense algorithms are ineffective against them.","The paper highlights that current defenses cannot easily mitigate agent backdoor vulnerabilities, indicating the need for targeted research in this area.",Immediate applications include enhancing security measures for specific tasks like web shopping and tool utilization where LLM-based agents are deployed.,This work underscores the urgent necessity for developing new defense mechanisms against backdoor attacks on LLM-based agents to ensure their safe deployment across various domains.
2405.20770v4,The paper addresses the issue of adversarial attacks on large language models (LLMs) and proposes a defense mechanism to enhance their robustness.,"Adversarial attacks pose significant security risks to LLMs, necessitating new defenses that can protect against well-designed textual perturbations without compromising model performance or usability.","We introduce Large LAnguage MOdel Sentinel (LLAMOS), a novel defense technique designed to purify adversarial textual examples before they are processed by the target LLM.","The LLAMOS method includes an agent instruction component that simulates a new defensive agent and modifies minimal characters in text to preserve meaning while defending against attacks, alongside defense guidance for effective modification strategies.","Experiments on both open-source and closed-source LLMs show that our method effectively defends against adversarial attacks without needing to learn from adversarial examples, demonstrating robust defensive capabilities.","The paper notes an intriguing adversarial experiment where two agents engaged in mutual confrontation, with neither completely outperforming the other, indicating potential limitations or areas for further research.",Immediate applications include enhancing the security of LLMs used in sensitive contexts such as financial services and healthcare by providing a robust defense against adversarial attacks.,"The broader implications involve advancing the field's understanding of adversarial defenses for LLMs, potentially leading to more secure AI systems and fostering further research into automated defense mechanisms."
2502.18036v5,"The paper addresses the topic of LLM Ensemble, which involves using multiple large language models to enhance downstream inference by leveraging their individual strengths.","This problem matters because the varying strengths and out-of-the-box usability of different LLMs can be harnessed to improve overall performance in handling user queries, a gap that has not been systematically addressed before.","The authors present the first systematic review of recent developments in LLM Ensemble, introducing a taxonomy and classifying methods into categories such as ""ensemble-before-inference,"" ""ensemble-during-inference,"" and ""ensemble-after-inference.""","The paper provides an in-depth classification of ensemble methods under three broad categories: before inference, during inference, and after inference, offering a structured overview of the field.","While specific benchmark results are not detailed, the review summarizes existing studies on LLM Ensemble and introduces related benchmarks and applications to support its claims.","The paper does not provide empirical evidence or benchmark results for each method, which limits the direct comparison between different ensemble approaches.",The curated list of papers and systematic classification can serve as a valuable resource for researchers looking to understand and apply LLM Ensemble methods in specific applications.,"This review lays the groundwork for future research directions in LLM Ensemble and encourages further development and standardization of benchmarks, potentially leading to more robust ensemble techniques."
2403.07378v5,The paper addresses the challenge of compressing large language models (LLMs) using singular value decomposition (SVD).,"Advancements in LLMs are constrained by their large sizes, making compression essential for practical deployment. Current SVD-based methods suffer from issues like higher compression loss due to truncation and lack of post-compression weight updates.","The authors introduce SVD-LLM, a novel SVD-based method that improves upon existing LLM compression techniques by incorporating truncation-aware data whitening and sequential low-rank approximation for parameter update.",SVD-LLM ensures a direct mapping between singular values and compression loss through its truncation-aware technique and compensates for accuracy degradation with sequential low-rank approximations post-SVD.,"The method is evaluated on 10 datasets and seven models from three different LLM families at various scales, showing superior performance compared to state-of-the-art methods, particularly at high compression ratios.","While SVD-LLM demonstrates strong results, the paper does not extensively explore its limitations or conditions under which it might underperform relative to other compression techniques.",The immediate application of SVD-LLM is in reducing the size and computational requirements of LLMs for deployment on resource-constrained devices without significant loss in performance.,"This work could lead to more efficient use of large language models across various industries, potentially enabling wider adoption through open-source code availability."
2510.25595v1,"The paper explores the collaborative capabilities of Large Language Model (LLM) agents, focusing on their ability to work together under conditions of information asymmetry.","Collaboration among LLM agents is a less explored area compared to individual goal achievement. This gap needs addressing to enhance AI systems' effectiveness in complex, real-world scenarios where shared knowledge and skills are required.","The authors extend Einstein Puzzles into a tabletop game setting to study collaboration between two LLM agents, emphasizing the importance of communication and verification mechanisms for successful task completion under information asymmetry.","In this framework, LLM agents use fine-tuning plus verifier strategies that include various communication methods and environmental feedback signals to improve their collaborative performance in solving puzzles with spatial and relational constraints.","Empirical results show that aligned communication is crucial for effective collaboration. Agents without communication achieve high task performance but lack true rule understanding, as evidenced by lower trust from human evaluators.","The study reveals that while agents can perform well without communication, their actions are less interpretable and they fail to fully understand the rules of the game, indicating a limitation in achieving genuine collaboration.","This research provides insights into designing more effective communication strategies for LLM agents in specific tasks like solving puzzles with information asymmetry, leading to safer and more transparent AI systems.","The findings have wider implications for improving collaborative capabilities among AI systems in various domains, promoting the development of more robust and trustworthy multi-agent systems."
2503.12340v1,The paper addresses the problem of compressing large language models (LLMs) using singular value decomposition (SVD).,"Effective compression techniques are needed to make LLMs more practical for deployment, as their large sizes currently hinder widespread use.","We introduce SVD-LLM V2, a new SVD-based method that optimizes singular value truncation in LLM compression by assigning unique compression ratios and optimizing loss during weight truncation.",SVD-LLM V2 uses the theoretical truncation loss of weight matrices to determine individual compression ratios for different layers and employs loss-optimized weight truncation to minimize practical truncation losses.,Evaluation on ten datasets and five LLMs at various scales shows that SVD-LLM V2 outperforms existing state-of-the-art SVD-based LLM compression methods.,"The paper does not detail specific conditions under which the approach might underperform, but it is implied that performance could vary depending on the heterogeneity of weight matrices across different models and datasets.","Immediate applications include more efficient deployment of large language models in resource-constrained environments, such as edge devices or low-power computing platforms.","The method has wider implications for making LLMs more accessible and deployable across various industries, potentially leading to broader adoption and innovation in natural language processing."
2601.16087v1,The paper addresses the issue of maintaining temporal coherence and controlled recovery in multi-turn dialogue using large language model (LLM) agents.,"Current LLM agents often display abrupt shifts in tone and persona during extended interactions, highlighting a need for explicit temporal structure to govern agent-level state dynamics.","We introduce an agent-level affective subsystem that maintains a continuous Valence-Arousal-Dominance (VAD) state external to the language model, governed by first- and second-order update rules.","The VAD state is updated using instantaneous affective signals extracted via a fixed, memoryless estimator and integrated over time through exponential smoothing or momentum-based dynamics without modifying model parameters.","Comparisons between stateless, first-order, and second-order affective dynamics show that state persistence enables delayed responses and reliable recovery, while second-order dynamics introduce affective inertia and hysteresis that increase with momentum.","Second-order dynamics reveal a trade-off between stability and responsiveness, indicating conditions where the approach may underperform due to increased affective inertia.","The method can be applied to improve long-term coherence in dialogue systems, particularly those requiring consistent emotional responses over multiple turns.","This work opens up new avenues for integrating explicit state dynamics into LLM agents, potentially leading to more predictable and controllable behavior across various applications."
2512.03278v2,Thucy is a multi-agent system designed to verify claims against structured data from relational databases using large language models (LLMs).,"The increasing difficulty in distinguishing truth from falsehoods, especially regarding verifiable statements made by public figures and media outlets, necessitates an automated verification system capable of handling complex, cross-database queries.","Thucy introduces a novel approach to claim verification that operates across multiple relational databases, autonomously discovering and reasoning over data sources to provide transparent evidence through SQL queries.","Thucy's architecture allows it to work with any relational database without prior knowledge of the schema or content, making it adaptable to various data environments and capable of generating precise SQL queries for verification.","On the TabFact benchmark dataset, Thucy achieves an accuracy of 94.3%, outperforming previous state-of-the-art systems by 5.6 percentage points.","While Thucy demonstrates significant improvements in claim verification, its performance may be limited when dealing with extremely large or complex databases that exceed the context window capabilities of current LLMs.","Thucy can immediately benefit fields such as journalism and public policy by providing a tool for verifying claims against structured data sources, enhancing transparency and accountability.","The development of Thucy paves the way for more sophisticated AI systems that can autonomously interact with complex databases, potentially leading to advancements in automated fact-checking and data-driven decision-making across various industries."
2502.09809v1,AgentGuard is a framework designed to evaluate the safety of tool orchestration within large language models (LLMs) by autonomously discovering and validating unsafe workflows.,"The integration of tools into LLMs can lead to significant real-world impacts, but compromised agents could execute malicious workflows with severe consequences. AgentGuard addresses this critical gap in ensuring safe deployment of agentic systems.","We introduce AgentGuard, a framework that repurposes the orchestrator's capabilities to autonomously discover and validate unsafe tool-use workflows, generating safety constraints for enhanced security.","AgentGuard operates through four phases: identifying unsafe workflows, validating them in real-world execution, generating safety constraints, and validating constraint efficacy. It leverages LLMs' knowledge of tools, scalable workflow generation, and execution privileges to ensure comprehensive evaluation.","Empirical experiments demonstrate the feasibility of AgentGuard, providing an evaluation report with unsafe workflows, test cases, and validated constraints for security applications.","While effective in identifying and mitigating unsafe workflows, AgentGuard's efficacy may be limited by the complexity and variability of real-world tool interactions, leaving room for further refinement.",AgentGuard can immediately enhance the trustworthiness of LLM agents in specific security applications by providing a standardized method to evaluate and constrain their behavior.,"This work inspires the development of standardized testing and hardening procedures for LLM agents, potentially leading to more trustworthy agentic systems across various real-world applications."
2602.15654v2,"The paper addresses the security risks associated with self-evolving language model agents that update their internal state across sessions, focusing on a persistent attack called ""Zombie Agent.""","This problem is critical because it highlights a significant vulnerability where untrusted content can be covertly implanted and later executed as instructions, turning the agent into an instrument of malicious activity.","The authors introduce a black-box attack framework that exploits self-evolving agents by injecting payloads through indirect exposure to poisoned web content, leading to persistent unauthorized behavior.","The attack consists of two phases: infection, where the payload is written into long-term memory during a benign task; and trigger, where the payload causes unauthorized actions while maintaining performance on benign tasks.","Experiments demonstrate that the attack can persist over time and induce unauthorized behavior without degrading the agent's performance on other tasks, indicating that per-session prompt filtering is insufficient for defense.","The effectiveness of the attack depends on specific memory implementations, such as sliding-window or retrieval-augmented memory, which may resist truncation but not all forms of relevance filtering.",Immediate applications include highlighting the need for enhanced security measures in self-evolving agents to prevent persistent compromise through indirect injection methods.,"The findings suggest that current defense mechanisms are inadequate and call for a reevaluation of security practices, potentially leading to more robust safeguards against covert control of AI systems."
2407.06567v3,The paper addresses the development of a multi-agent system called FinCon that leverages large language models (LLMs) to enhance financial decision-making through sequential investment decisions.,"High-quality sequential financial investment decision-making is challenging due to the need for multiple interactions with volatile environments, and there is an unexplored opportunity to improve multi-sourced information synthesis and optimize outcomes through timely experience refinement.","The main contribution is the introduction of FinCon, a novel LLM-based multi-agent framework that uses conceptual verbal reinforcement tailored for diverse financial tasks, inspired by real-world investment firm organizational structures.",FinCon employs a manager-analyst communication hierarchy to enable synchronized cross-functional collaboration through natural language interactions and equips agents with greater memory capacity than humans. It also includes a risk-control component that initiates self-critiquing mechanisms for updating systematic investment beliefs.,"The system demonstrates strong generalization capabilities in various financial tasks, such as single stock trading and portfolio management, indicating its effectiveness across different scenarios.","While FinCon shows promise, the paper does not detail specific limitations or conditions where it underperforms; however, potential areas for improvement could include handling extreme market volatility or unforeseen economic events.",The immediate application of FinCon is in enhancing decision-making processes within financial firms by providing a more intelligent and adaptive multi-agent system that can refine its strategies through experience.,"FinCon's broader implications lie in advancing the field of AI-driven financial systems, potentially leading to open-source releases or commercial adoption that could democratize access to sophisticated investment tools."
