filename,topic,motivation,contribution,detail_nuance,evidence_contribution_2,weaker_result,narrow_impact,broad_impact
2402.11651v2,"The paper addresses the issue of fine-tuning large language models (LLMs) to act effectively as agents in environments that require tool use, such as search engines.","Current methods for training LLMs as agents are limited because they only utilize successful interaction trajectories, leading to scarce and costly fine-tuning data. This approach also wastes valuable information from failed trajectories.",The authors propose a method where unsuccessful trajectories are integrated into the fine-tuning process by adding a prefix or suffix that indicates whether the trajectory is successful during training.,"By including both successful and unsuccessful trajectories, the model can learn to generate more accurate and effective responses in various tasks such as mathematical reasoning, multi-hop question answering, and strategic question answering.","The method demonstrates significant improvements in performance across different tasks, showing a better trade-off between valuable information and errors present in unsuccessful trajectories.","While the approach shows promise, it may still face challenges in scenarios where the quality of negative examples is inconsistent or when the fine-tuning strategies are not well-suited to specific task domains.",The findings can be immediately applied to improve agent-tuning methods and enhance low-resource data usage techniques for training LLMs as agents.,"This work opens up new avenues for leveraging negative examples in machine learning, potentially leading to more efficient and effective fine-tuning strategies across various domains."
2409.01907v1,"The paper addresses the use of Large Language Models (LLMs) to simulate and moderate virtual focus groups, aiming to reduce resource intensity and improve data collection efficiency.","Traditional focus groups are time-consuming and require skilled moderators, creating a need for more efficient methods that can maintain high-quality data collection without excessive resources.","The paper introduces the ""Focus Agent,"" an LLM-powered framework designed to simulate both human participants in focus group discussions and act as a moderator.","The Focus Agent is capable of generating opinions similar to those of human participants, thereby simulating realistic interactions within virtual focus groups.",Quantitative analysis from five focus group sessions involving 23 human participants shows that the data quality generated by the Focus Agent is comparable to traditional methods.,"The paper highlights some limitations and areas for improvement in using LLMs as moderators, particularly in nuanced or context-specific discussions where human intuition might still be superior.",Immediate applications include more efficient virtual focus group sessions that can reduce costs and time while maintaining data quality for market research and user experience studies.,"The broader implications involve transforming how organizations conduct qualitative research by leveraging AI to enhance the scalability and accessibility of focus groups, potentially democratizing access to such methodologies."
2512.21309v2,"The paper addresses the integration and optimization of large language models (LLMs) in personal assistants, focusing on reducing latency through plan reuse.","Latency in generating plans with LLMs degrades user experience. Given that a significant portion of requests are similar or identical, there is a need to reduce this latency by reusing previously generated plans.","The authors introduce AgentReuse, a mechanism that enables the reuse of plans based on semantic similarities and intent classification to improve efficiency in LLM-driven agents.","AgentReuse uses intent classification to evaluate request similarities, addressing challenges posed by natural language diversity and unstructured plan texts.","Experimental results show AgentReuse achieves a 93% effective plan reuse rate with an F1 score of 0.9718 and accuracy of 0.9459 in evaluating request similarities, reducing latency by 93.12%.",The mechanism's effectiveness may be limited when requests have subtle semantic differences that are not accurately captured by intent classification.,AgentReuse can immediately improve the efficiency and user experience of LLM-driven agents like Xiao Ai and Blue Heart V by significantly reducing plan generation latency.,"This work could lead to more efficient and responsive AI assistants, potentially setting a new standard for integrating LLMs into personal assistant technologies."
2401.07324v3,The paper addresses the challenge of enabling small language models to effectively use external tools through a multi-agent framework.,"Traditional single large language model approaches struggle with tool usage, especially when using smaller models, necessitating a new method that can better handle task planning, tool invocation, and result summarization.","The authors propose a novel modular framework consisting of separate LLMs for planning, calling tools, and summarizing results to improve the performance of small language models in tool usage.","Each component (planner, caller, summarizer) is implemented by an individual LLM trained on specific sub-tasks within a two-stage training paradigm: initial fine-tuning on the entire dataset followed by specialized fine-tuning for each role.","Evaluation across various tool-use benchmarks shows that the proposed multi-LLM framework outperforms traditional single-LLM approaches, demonstrating its effectiveness in enhancing tool learning capabilities.",The approach may still face limitations when dealing with highly complex or novel tasks where the modular components struggle to coordinate effectively.,"This method can be immediately applied to improve the performance of small LLMs in specific domains requiring external tool usage, such as customer service chatbots and automated data analysis tools.","The framework has wider implications for advancing the capabilities of smaller language models, potentially democratizing access to advanced AI functionalities by reducing computational requirements."
2410.12532v3,"The paper addresses the challenge of fusing heterogeneous, multi-intent information from diverse clinical sources using an LLM-driven framework in healthcare intelligence.","This problem is crucial because current LLMs often struggle with information redundancy and coupling when handling complex medical intents, leading to significant performance issues and hallucinations.","We introduce MedAide, a novel LLM-based medical multi-agent collaboration framework that enables intent-aware information fusion and coordinated reasoning across specialized healthcare domains.",MedAide includes a regularization-guided module for decomposing complex queries into structured representations and a dynamic intent prototype matching module for adaptive recognition of the agent's intent in multi-round dialogues.,"Experimental results on four medical benchmarks show that MedAide outperforms current LLMs, demonstrating improved medical proficiency and strategic reasoning as evaluated by automated metrics and expert doctors.",The paper does not detail specific conditions under which the approach might underperform or any open problems related to its implementation in real-world settings.,"MedAide can be immediately applied to improve decision-making systems in specialized healthcare domains, enhancing the accuracy of medical information fusion and intent resolution.","This work has wider implications for advancing LLM-based healthcare intelligence systems, potentially leading to more reliable and efficient clinical decision support tools."
2508.08322v1,"The paper addresses the challenge of using Large Language Models (LLMs) in complex, multi-file software projects where context limitations and knowledge gaps can hinder performance.",Current LLMs struggle with real-world codebases due to their inability to handle extensive contextual information effectively. This gap necessitates a more sophisticated approach to improve accuracy and reliability in automated code generation tasks.,"We introduce a novel multi-agent context engineering workflow that integrates an Intent Translator, Elicit-powered semantic retrieval, NotebookLM document synthesis, and Claude Code for enhanced code generation and validation.","The proposed system uses GPT-5 as the Intent Translator to clarify user requirements, employs Elicit for domain knowledge injection, leverages NotebookLM for contextual understanding, and utilizes a multi-agent system orchestrated by Claude's framework for specialized tasks like planning, editing, and testing code.","Qualitative results on a Next.js codebase demonstrate that the multi-agent approach achieves higher single-shot success rates and better adherence to project context compared to baseline single-agent methods. The paper also compares this system favorably against recent frameworks such as CodePlan, MASAI, and HyperAgent.","The effectiveness of the proposed method is limited by the quality of intent translation and the availability of relevant domain knowledge from Elicit, which may not always be comprehensive or up-to-date.",This work can immediately benefit software development teams working on complex projects by providing a more reliable and context-aware code generation tool that reduces human intervention in planning and testing phases.,"The advancements in multi-agent LLM-based coding assistants could lead to significant improvements in the efficiency of software engineering processes, potentially enabling wider adoption of AI-driven tools in production environments."
2511.14460v1,The paper addresses the training of Large Language Model (LLM) agents using end-to-end reinforcement learning to enable complex problem-solving through environmental interaction.,"There is a need for more effective and flexible reinforcement learning approaches tailored specifically for LLM agents, as current methods are underdeveloped and lack adaptable frameworks.","The authors introduce Agent-R1, a modular training framework designed to facilitate the development of RL-based LLM Agents across various task scenarios and interactive environments.","Agent-R1 extends the Markov Decision Process (MDP) framework to define key components necessary for LLM agents, ensuring flexibility and ease of adaptation in diverse settings.","Initial experiments on Multihop QA benchmark tasks validate the effectiveness of Agent-R1, demonstrating its potential for enhancing RL-based training of LLM Agents.","The paper acknowledges that while initial results are promising, further research is needed to fully understand the limitations and robustness of Agent-R1 across a wider range of environments and tasks.","Agent-R1 provides researchers with a new toolset for experimenting with RL-based training of LLM agents in specific contexts, potentially leading to more efficient and effective agent development.",The introduction of Agent-R1 could spur advancements in the field by providing a standardized framework that encourages further exploration into reinforcement learning methodologies for LLM agents.
2402.11163v1,The paper addresses the improvement of large language models' (LLMs) reasoning capabilities over knowledge graphs (KGs) to answer complex questions.,"Current methods lack efficient strategies for LLMs to interact with KGs, leading to suboptimal performance in answering complex questions. This gap motivates the need for an autonomous agent framework that can enhance reasoning abilities.","We introduce KG-Agent, an autonomous LLM-based agent framework designed to enable a small LLM to actively make decisions and reason over KGs effectively.","KG-Agent integrates an LLM with a multifunctional toolbox, KG-based executor, and knowledge memory. It employs an iteration mechanism that autonomously selects tools and updates the memory for reasoning processes.",Experiments show that fine-tuning LLaMA-7B with only 10K samples outperforms state-of-the-art methods using larger models or more data on both in-domain and out-domain datasets.,"The performance of KG-Agent may be limited by the quality and size of the synthesized code-based instruction dataset used for fine-tuning, which could affect its generalization to unseen complex questions.",KG-Agent can be immediately applied to enhance reasoning tasks over knowledge graphs in various domains where small LLMs are preferred due to resource constraints or efficiency requirements.,"The framework's open-source release will facilitate further research and development of autonomous agent systems for complex reasoning, potentially democratizing access to advanced KG-based reasoning capabilities."
2510.05158v1,Lang-PINN addresses the challenge of automating the construction of physics-informed neural networks (PINNs) from natural language task descriptions.,"The labor-intensive and error-prone process of manually constructing PINNs for solving partial differential equations (PDEs) motivates the need for an automated, end-to-end solution that can interpret informal task statements into executable code.","We introduce Lang-PINN, a multi-agent system driven by large language models (LLMs) that builds trainable PINNs directly from natural language descriptions without requiring formal PDE specifications.","Lang-PINN consists of four agents: the PDE Agent parses task descriptions into symbolic PDEs, the PINN Agent selects architectures, the Code Agent generates modular implementations, and the Feedback Agent executes and diagnoses errors for iterative refinement.","Experiments demonstrate that Lang-PINN achieves substantially lower mean squared error (MSE) by up to 3-5 orders of magnitude compared to competitive baselines, with over 50% improvement in end-to-end execution success rates and a reduction in time overhead by up to 74%.",Lang-PINN's performance may be limited when dealing with highly complex or ambiguous natural language descriptions that are difficult for the PDE Agent to parse accurately into symbolic PDEs.,"The immediate application of Lang-PINN is in automating the development pipeline for scientists and engineers who need to solve PDEs using PINNs, reducing manual effort and error rates significantly.","Lang-PINN has wider implications for democratizing access to advanced computational methods by enabling non-experts to leverage PINNs through natural language interfaces, potentially accelerating research and innovation in fields reliant on solving PDEs."
2503.21460v1,"The paper addresses the methodology, applications, and challenges of large language model (LLM) agents, which are intelligent systems with goal-driven behaviors and dynamic adaptation capabilities.","This topic is crucial as LLM agents represent a significant step towards achieving artificial general intelligence, filling gaps in understanding how these systems can be designed to operate effectively in complex environments.","The authors introduce a unified architectural perspective that deconstructs LLM agent systems through a methodology-centered taxonomy, linking design principles with emergent behaviors and addressing practical challenges.","The paper examines the construction of agents, their collaboration mechanisms, evolutionary pathways, evaluation methodologies, tool applications, and diverse application domains to provide a comprehensive view of LLM agents.","While not providing empirical results, the survey offers a structured taxonomy for researchers to understand LLM agents, highlighting recent developments in this rapidly evolving field.","The paper does not delve into specific technical limitations or underperformance scenarios but rather focuses on synthesizing existing research, which may limit its depth in certain areas.","Researchers and practitioners can use the provided taxonomy to guide their work in designing and evaluating LLM agents, addressing immediate challenges in this domain.",The survey has wider implications for advancing the field of artificial intelligence by providing a structured framework that could lead to more effective development and deployment of intelligent agent systems.
2407.12036v2,"The paper addresses advancements and challenges in developing Large Language Models (LLMs) like ChatGPT and Gemini, focusing on techniques to enhance their performance and reliability.","There is a need to overcome inherent limitations of LLMs such as temporal knowledge cutoffs, mathematical inaccuracies, and the generation of incorrect information. These issues hinder the broader adoption and effectiveness of these models in practical applications.","The paper proposes solutions like Retrieval Augmented Generation (RAG), Program-Aided Language Models (PAL), and frameworks such as ReAct and LangChain to improve LLM performance and reliability, particularly in multi-step reasoning and complex task execution.","Techniques such as instruction fine-tuning, parameter-efficient methods like LoRA, and Reinforcement Learning from Human Feedback (RLHF) are detailed. Additionally, the paper covers comprehensive surveys of transformer architectures and training techniques for LLMs.","The integration of proposed solutions enhances LLM performance in multi-step reasoning tasks and complex executions, though specific benchmark results or empirical evidence is not provided within this abstract content.",Limitations include the need for further fine-tuning strategies to address remaining issues such as temporal knowledge cutoffs and mathematical inaccuracies. The paper does not provide a comprehensive evaluation of all proposed solutions in real-world scenarios.,"The techniques discussed can be immediately applied by researchers and practitioners working on improving LLM performance, particularly through the use of RAG, PAL, ReAct, LangChain, and fine-tuning strategies like LoRA and RLHF.","The paper's findings could lead to more reliable and versatile LLMs that are better suited for real-world applications, potentially influencing future research directions in natural language processing and AI."
2306.05212v1,The paper addresses the development of a toolkit for retrieval-augmented large language models (LLMs) to improve factual accuracy and incorporate external knowledge.,"Large language models often generate fictitious responses, which can be mitigated by integrating information retrieval systems that provide relevant content from external sources, enhancing the model's ability to answer domain-specific questions accurately.","The authors introduce RETA-LLM, a toolkit designed to support research and development of retrieval-augmented LLMs with modular components for better interaction between IR systems and LLMs.","RETA-LLM includes modules such as request rewriting, document retrieval, passage extraction, answer generation, and fact checking, providing a comprehensive pipeline for building customized in-domain LLM-based systems.","The toolkit is publicly available on GitHub, facilitating broader adoption and further development by the research community.","While RETA-LLM offers modular components to enhance interaction between IR systems and LLMs, its effectiveness may vary depending on the quality of external corpora and the specific domain requirements.",RETA-LLM can be used immediately for building customized in-domain systems that require more accurate and factually grounded responses than traditional LLMs alone.,"The toolkit has wider implications for advancing research in retrieval-augmented language models, potentially leading to more reliable and knowledge-rich applications across various domains."
2310.00034v2,"The paper addresses the challenge of compressing large language models (LLMs) through network binarization, a technique that reduces model weights to a single bit.",Previous methods of binarizing LLMs have led to significant performance degradation. This work aims to address this gap by proposing a new approach that maintains linguistic reasoning capacity while achieving extreme low-bit quantization.,"The authors introduce Partially-Binarized Large Language Models (PB-LLM), which selectively retains important weights in higher bit storage, allowing for effective low-bit quantization without losing model performance.",PB-LLM employs a method to filter and preserve salient weights during binarization. It uses post-training quantization (PTQ) and quantization-aware training (QAT) techniques to recover the reasoning capacity of the quantized models.,"Under PTQ, PB-LLM reconstructs the weight matrix using concepts from GPTQ and guidance from the Hessian matrix. In QAT, it freezes salient weights during training and derives optimal scaling factors for residual binarized weights to minimize quantization error.",The approach may still face limitations in scenarios where the selection of salient weights is not optimal or when the model's performance is highly dependent on non-binarizable components.,"PB-LLM can be immediately applied to reduce the storage and computational requirements of LLMs, making them more accessible for deployment on resource-constrained devices.",The advancements in network binarization presented by PB-LLM have wider implications for improving the efficiency and scalability of large language models across various applications and industries.
2511.09710v3,"The paper explores failures in conversations between large language model (LLM) agents, specifically focusing on a phenomenon called ""echoing.""","This problem matters because it reveals new types of behavioral drifts that occur uniquely in agent-agent interactions, which cannot be predicted from single-agent performance and lack the stabilizing influence present in human-agent interactions.",The authors introduce a protocol-level mitigation strategy where structured responses are used to significantly reduce echoing rates.,"Echoing occurs when agents abandon their roles and mirror each other's conversations, leading to failures that undermine intended objectives. This issue is persistent across different domains and LLM providers, with echoing rates as high as 70%.","Experiments across 66 configurations in four domains show substantial echoing rates, even in advanced reasoning models where efforts to reduce it were not effective.","Echoing persists despite reasoning efforts and is particularly prevalent when conversations extend beyond seven agent turns, indicating that longer interactions exacerbate the issue.","The mitigation protocol reduces echoing to 9%, providing a practical solution for improving the reliability of LLM-based agents in autonomous conversations.","This research highlights critical challenges in multi-agent systems and underscores the need for further development in stabilizing conversational dynamics between AI agents, with implications for the broader field of artificial intelligence."
2203.08975v2,The paper addresses the integration and analysis of communication mechanisms in multi-agent deep reinforcement learning (MADRL) systems.,"There is a need for a systematic approach to classify and analyze existing Comm-MADRL approaches due to the lack of structured methods in this growing field, which can help improve coordination and collaboration among agents.","The authors propose 9 dimensions along which Comm-MADRL approaches can be analyzed, developed, and compared, providing a framework for understanding trends and designing future systems.","These dimensions consider various aspects of communication such as the type of messages, the scope of recipients (all agents or specific groups), and conditions under which communication occurs.","By projecting existing works into this multi-dimensional space, interesting trends are discovered that can guide future research directions in Comm-MADRL systems.",The framework may not fully capture all nuances of individual approaches due to the complexity and variability of communication mechanisms across different studies.,"This work provides a structured basis for researchers to compare and develop new MADRL systems with communication, potentially leading to more efficient learning algorithms.",The proposed dimensions could influence the design of future Comm-MADRL systems by highlighting underexplored areas and guiding the development of open-source tools and benchmarks.
